{"verifrax_version":"2.6.0","certificate_version":"1.0.0","bundle_hash":"6f95d18247f958c7253d542229a427db008152f02856bd52f3023cb610ecdf21","profile_id":"public@1.0.0","verdict":"not_verified","reason_codes":["BUNDLE_TOO_LARGE"],"executed_at":"2026-01-01T21:47:46.199Z","certificate_hash":"52e8bac77d26d7dccc7fbf1c1d25b883d2dc409c45879d6b3d849e4676b94539"}